{
  "caseId": "%caseId%",
  "courtFormId": "%courtFormId%",
  "formType": "BCM",
  "hearingDateTime": "2025-12-22T10:45:00Z",
  "caseURN": "TFL4359536",
  "updatedBy": {
    "id": "%userId%",
    "firstName": "firstName",
    "lastName": "lastName"
  },
  "documentMetaData": [
    {
      "isWelsh": true,
      "materialId": "861922c8-28e6-4c73-866b-b80e270b1655",
      "fileName": "fileName One.pdf"
    },
    {
      "isWelsh": true,
      "materialId": "c0b6d9e0-5b89-4f7e-a457-894f17217486",
      "fileName": "fileName One.pdf"
    },
    {
      "isWelsh": true,
      "materialId": "37aa859a-6a13-4440-8ed9-489a668f8e7f",
      "fileName": "fileName One.pdf"
    }
  ]
}